<?xml version="1.0" encoding="UTF-8" ?>
<!DOCTYPE menu SYSTEM "../dtd/menu.dtd">
<menu>
	<menu_id>0</menu_id>
	<title>Default Menu</title>
	<description>Normal menu when nothing special is on</description>
	<items>
		<item>
            <default_id>0</default_id>
			<item_id>0</item_id>
			<name>Boring Burger</name>
			<item_description>A burger so boring it's just some cheese in a bun</item_description>
			<recipes>
				<recipe_id>0</recipe_id>
				<recipe_id>1</recipe_id>
			</recipes>
		</item>
	</items>
</menu>